{
  "id": "11111111-1111-1111-1111-111111111111",
  "sequence": 42,
  "event_type": "ACTION_AUTHORIZED",
  "timestamp": "2026-10-02T16:01:05Z",
  "actor": {
    "id": "supervisor-daemon",
    "role": "Runtime"
  },
  "run_id": "22222222-2222-2222-2222-222222222222",
  "payload": {
    "action_id": "33333333-3333-3333-3333-333333333333",
    "policy_id": "policy_dev_project_write_v1"
  },
  "prev_hash": "e3b0c44298fc1c149afbf4c8996fb92427ae41e4649b934ca495991b7852b855",
  "hash": "ba7816bf8f01cfea414140de5dae2223b00361a396177a9cb410ff61f20015ad",
  "signature": "3045022100e3b0c44298fc1c149afbf4c8996fb92427ae41e4649b934ca495991b7852b855022026e6f1a8c08efca8892eb5f5ff72d0012e1ffb1bc13e2bfad4ff6603a1188358"
}
